"BR-055","AI/ML","Machine learning model dependency management","Model Dependency Conflicts and Versioning","Maintainability","Complex dependency chains, version conflicts, and lack of dependency management can cause model deployment failures, reproducibility issues, and maintenance challenges.","Use containerization for models, implement dependency pinning, maintain requirements files, use virtual environments, and test across different dependency versions."
"BR-056","AI/ML","Machine learning model ethical considerations","Ethical AI Violations and Misuse","Compliance","Models used for unethical purposes, lack of ethical review processes, and inadequate consideration of societal impact can result in harm to individuals, reputational damage, and regulatory scrutiny.","Establish ethical AI guidelines, conduct ethical impact assessments, implement review boards, ensure transparency in model use, and establish accountability mechanisms."
"BR-057","AI/ML","Machine learning model resource optimization","Inefficient Model Resource Utilization","Performance","Oversized models, inefficient architectures, and lack of optimization can waste computational resources, increase costs, and reduce the number of models that can be deployed simultaneously.","Implement model compression techniques, use knowledge distillation, optimize model architectures, conduct resource profiling, and establish efficiency metrics."
"BR-058","AI/ML","Machine learning model integration with applications","Model-Application Integration Failures","Interoperability","Poor API design, incompatible data formats, and lack of integration testing can cause failures when integrating ML models with production applications, leading to system errors and downtime.","Design robust APIs for model serving, implement data validation and transformation layers, conduct integration testing, and maintain API versioning and documentation."
"BR-059","AI/ML","Machine learning model regulatory compliance","AI Regulatory Compliance Violations","Compliance","Failure to comply with emerging AI regulations (EU AI Act, etc.), lack of transparency, and inadequate risk assessments can result in fines, legal liabilities, and restrictions on model deployment.","Stay informed on AI regulations, conduct regulatory impact assessments, implement transparency measures, maintain compliance documentation, and engage with legal counsel."
"BR-060","AI/ML","Machine learning model security scanning","ML Model Vulnerability Exploitation","Security","Vulnerabilities in ML frameworks, libraries, and model serving infrastructure can be exploited by attackers to compromise systems, steal data, or manipulate model behavior.","Conduct regular security scanning of ML infrastructure, keep frameworks updated, implement security best practices, use vulnerability management tools, and conduct penetration testing."
