# Audit Log: Exported 60 risk records | Timestamp: 2024-06-12T12:00:00Z | File: Risk_Details_Base/risk_identification_details.csv | Status: Success | Validation: All records valid
"Risk ID","Technology","Context","Risk Title","Risk Category","Risk Description","Base Mitigation"
"BR-001","Data Engineering","ETL/ELT pipeline development and data transformation workflows","Data Pipeline Failure and Data Loss","Reliability","Data engineering pipelines may fail due to network issues, resource exhaustion, or code errors, leading to incomplete data loads, data loss, and downstream analytics failures that impact business intelligence and decision-making.","Implement robust error handling, retry mechanisms, dead letter queues, pipeline monitoring with alerting, and maintain comprehensive audit logs for all data movements."
"BR-002","Data Engineering","Large-scale data processing and transformation","Data Quality and Integrity Issues","Data Integrity","Inadequate data validation, schema drift, duplicate records, and transformation errors can result in poor data quality, corrupted datasets, and unreliable analytics outputs that undermine business decisions.","Implement data quality frameworks with validation rules, schema enforcement, deduplication logic, data profiling, and automated quality checks at each pipeline stage."
"BR-003","Data Engineering","Handling sensitive and regulated data in pipelines","Data Privacy and Compliance Violations","Compliance","Processing PII, PHI, or other regulated data without proper controls can lead to GDPR, HIPAA, CCPA violations, resulting in significant fines, legal liabilities, and reputational damage.","Implement data classification, encryption at rest and in transit, data masking/anonymization, access controls, audit logging, and regular compliance assessments."
"BR-004","Data Engineering","Data lake and data warehouse architectures","Unauthorized Data Access and Exfiltration","Security","Inadequate access controls, overly permissive IAM policies, and lack of data governance can allow unauthorized users to access, modify, or exfiltrate sensitive data from data repositories.","Implement least privilege access, role-based access control (RBAC), data access auditing, encryption, network segmentation, and regular access reviews."
"BR-005","Data Engineering","Distributed data processing frameworks (Spark, Hadoop, etc.)","Performance Bottlenecks and Resource Contention","Performance","Inefficient data processing logic, poor partitioning strategies, resource contention, and inadequate cluster sizing can cause slow pipeline execution, missed SLAs, and increased infrastructure costs.","Optimize data partitioning, implement caching strategies, tune cluster configurations, monitor resource utilization, and conduct performance testing and profiling."
"BR-006","Data Engineering","Scaling data pipelines for growing data volumes","Horizontal Scaling Limitations","Scalability","Data pipelines may struggle to scale horizontally as data volumes grow, leading to processing delays, resource exhaustion, and inability to meet business demands for real-time or near-real-time analytics.","Design for horizontal scalability using distributed processing frameworks, implement auto-scaling, use cloud-native services, and architect for elastic compute resources."
"BR-007","Data Engineering","CI/CD for data pipeline deployment","Pipeline Deployment Failures and Rollback Issues","DevOps/Deployment","Inadequate testing, lack of version control, and poor deployment practices can result in failed pipeline deployments, production outages, and difficulty rolling back to stable versions.","Implement comprehensive CI/CD pipelines with automated testing, version control for all pipeline code, blue-green deployments, canary releases, and automated rollback mechanisms."
"BR-008","Data Engineering","Data pipeline orchestration and scheduling","Job Scheduling Conflicts and Dependencies","Reliability","Complex job dependencies, scheduling conflicts, and lack of proper orchestration can cause pipeline failures, data inconsistencies, and cascading failures across dependent systems.","Use robust orchestration tools (Airflow, Prefect, etc.), implement clear dependency management, set appropriate timeouts and retries, and monitor job execution status."
"BR-009","Data Engineering","Real-time streaming data processing","Stream Processing Lag and Backpressure","Performance","High-velocity data streams can overwhelm processing capacity, causing lag, backpressure, data loss, and inability to deliver real-time insights required for time-sensitive business operations.","Implement backpressure handling, use scalable streaming platforms (Kafka, Kinesis), optimize stream processing logic, and monitor lag metrics with alerting."
"BR-010","Data Engineering","Data lineage and metadata management","Lack of Data Lineage and Traceability","Compliance","Absence of data lineage tracking makes it difficult to trace data origins, transformations, and usage, hindering compliance audits, impact analysis, and root cause investigation.","Implement data lineage tools, maintain comprehensive metadata catalogs, document data flows, and integrate lineage tracking into all pipeline stages."
"BR-011","Data Engineering","Multi-cloud and hybrid data architectures","Data Consistency Across Distributed Systems","Data Integrity","Maintaining data consistency across multiple cloud providers, on-premises systems, and distributed data stores is challenging and can lead to data discrepancies and synchronization issues.","Implement eventual consistency patterns, use distributed transaction protocols where necessary, implement data reconciliation processes, and monitor data consistency metrics."
"BR-012","Data Engineering","Data pipeline monitoring and observability","Insufficient Monitoring and Alerting","Availability","Lack of comprehensive monitoring and alerting for data pipelines can result in undetected failures, prolonged outages, and delayed incident response, impacting data availability and business operations.","Implement end-to-end pipeline monitoring, set up proactive alerting for failures and SLA breaches, use observability tools, and establish on-call procedures."
"BR-013","Data Engineering","Legacy system integration and data migration","Technical Debt and Legacy System Dependencies","Maintainability","Dependencies on legacy systems, outdated technologies, and accumulated technical debt can hinder pipeline modernization, increase maintenance costs, and create security vulnerabilities.","Develop modernization roadmaps, refactor legacy code incrementally, document dependencies, implement abstraction layers, and prioritize technical debt reduction."
"BR-014","Data Engineering","Third-party data source integration","External Data Source Reliability and Availability","Reliability","Dependencies on external data sources and APIs can introduce reliability risks due to third-party outages, rate limiting, schema changes, and data quality issues beyond organizational control.","Implement circuit breakers, caching strategies, fallback mechanisms, SLA monitoring for external sources, and maintain alternative data sources where critical."
"BR-015","Data Engineering","Data encryption and key management","Encryption Key Management Vulnerabilities","Security","Poor key management practices, hardcoded keys, inadequate key rotation, and insecure key storage can compromise data encryption and expose sensitive data to unauthorized access.","Use dedicated key management services (AWS KMS, Azure Key Vault), implement automated key rotation, enforce separation of duties, and audit key access."
"BR-016","Data Engineering","Data pipeline configuration management","Configuration Drift and Inconsistencies","DevOps/Deployment","Manual configuration changes, lack of infrastructure as code, and configuration drift across environments can lead to inconsistent pipeline behavior, deployment failures, and security gaps.","Implement infrastructure as code (Terraform, CloudFormation), use configuration management tools, enforce environment parity, and conduct regular configuration audits."
"BR-017","Data Engineering","Data warehouse query performance","Query Performance Degradation","Performance","Poorly optimized queries, lack of indexing, inadequate partitioning, and growing data volumes can cause slow query performance, impacting analytics and reporting capabilities.","Implement query optimization best practices, use appropriate indexing strategies, partition large tables, monitor query performance, and conduct regular performance tuning."
"BR-018","Data Engineering","Data retention and archival policies","Data Retention Compliance Risks","Compliance","Failure to implement proper data retention and deletion policies can result in regulatory violations, increased storage costs, and legal liabilities related to data privacy regulations.","Define and enforce data retention policies, implement automated data lifecycle management, conduct regular data audits, and ensure compliance with regulatory requirements."
"BR-019","Data Engineering","Data pipeline testing and validation","Inadequate Testing Coverage","Data Integrity","Insufficient unit testing, integration testing, and data validation can allow bugs and data quality issues to reach production, causing data corruption and unreliable analytics.","Implement comprehensive testing strategies including unit tests, integration tests, data quality tests, and automated validation checks in CI/CD pipelines."
"BR-020","Data Engineering","Disaster recovery and business continuity","Inadequate Disaster Recovery Planning","Reliability","Lack of disaster recovery plans, insufficient backups, and untested recovery procedures can result in prolonged data unavailability and significant business impact during disasters or major incidents.","Implement comprehensive backup strategies, establish RPO/RTO targets, conduct regular disaster recovery drills, and maintain geographically distributed backups."
"BR-021","Data Engineering","Data pipeline documentation and knowledge transfer","Knowledge Silos and Documentation Gaps","Maintainability","Inadequate documentation, knowledge silos, and lack of knowledge transfer can hinder pipeline maintenance, troubleshooting, and onboarding, increasing operational risks and costs.","Maintain comprehensive documentation, implement code comments and README files, conduct knowledge sharing sessions, and use collaborative documentation platforms."
"BR-022","Data Engineering","Data pipeline cost optimization","Uncontrolled Infrastructure Costs","Performance","Inefficient resource utilization, lack of cost monitoring, and over-provisioned infrastructure can lead to excessive cloud costs and budget overruns without corresponding business value.","Implement cost monitoring and alerting, optimize resource allocation, use spot instances where appropriate, implement auto-scaling, and conduct regular cost reviews."
"BR-023","Data Engineering","Data catalog and discovery","Data Discovery and Accessibility Challenges","Maintainability","Lack of data catalogs and discovery tools can make it difficult for users to find and understand available datasets, leading to duplicated efforts, inconsistent data usage, and reduced productivity.","Implement data catalog solutions, maintain metadata repositories, enforce data documentation standards, and provide self-service data discovery tools."
"BR-024","Data Engineering","Data pipeline security scanning","Vulnerable Dependencies and Libraries","Security","Use of outdated or vulnerable third-party libraries and dependencies in data pipelines can introduce security vulnerabilities and expose systems to known exploits and attacks.","Implement automated dependency scanning, maintain up-to-date libraries, use software composition analysis tools, and establish vulnerability remediation processes."
"BR-025","Data Engineering","Data pipeline idempotency and reprocessing","Non-Idempotent Pipeline Operations","Data Integrity","Lack of idempotency in data pipelines can cause data duplication, inconsistencies, and incorrect results when pipelines are rerun or retried after failures.","Design pipelines for idempotency, implement deduplication logic, use upsert operations, and maintain processing state to enable safe reprocessing."
"BR-026","Data Engineering","Data pipeline change management","Uncontrolled Schema and Pipeline Changes","Reliability","Uncontrolled schema changes, breaking pipeline modifications, and lack of change management processes can cause downstream failures and data inconsistencies across dependent systems.","Implement schema versioning, use backward-compatible changes, establish change approval processes, and conduct impact analysis before modifications."
"BR-027","Data Engineering","Data pipeline resource isolation","Resource Contention Between Pipelines","Performance","Lack of resource isolation between different data pipelines can cause resource contention, where high-priority pipelines are impacted by resource-intensive low-priority jobs.","Implement resource quotas and limits, use separate compute clusters for different workloads, implement priority-based scheduling, and monitor resource utilization."
"BR-028","Data Engineering","Data pipeline audit and compliance logging","Insufficient Audit Trails","Compliance","Inadequate logging of data access, transformations, and pipeline operations can hinder compliance audits, forensic investigations, and accountability for data handling.","Implement comprehensive audit logging, capture data lineage information, maintain immutable logs, and ensure log retention meets regulatory requirements."
"BR-029","Data Engineering","Data pipeline network security","Insecure Network Communications","Security","Unencrypted data transmission, exposed endpoints, and inadequate network segmentation can allow attackers to intercept sensitive data in transit or gain unauthorized access to pipeline infrastructure.","Enforce TLS/SSL for all data transmission, implement network segmentation, use VPCs and private endpoints, and restrict network access with security groups and firewalls."
"BR-030","Data Engineering","Data pipeline capacity planning","Inadequate Capacity Planning","Scalability","Failure to anticipate data growth and processing requirements can lead to capacity constraints, performance degradation, and inability to meet business demands during peak periods.","Conduct regular capacity planning exercises, monitor growth trends, implement proactive scaling strategies, and maintain capacity buffers for unexpected demand."
"BR-031","AI/ML","Machine learning model training and development","Model Training Data Poisoning","Security","Malicious actors can inject poisoned data into training datasets to manipulate model behavior, introduce backdoors, or cause models to produce incorrect predictions that benefit attackers.","Implement data provenance tracking, validate training data sources, use anomaly detection on training data, and conduct adversarial testing of models."
"BR-032","AI/ML","Machine learning model deployment and inference","Model Inference Performance Bottlenecks","Performance","Complex models, inefficient inference code, and inadequate infrastructure can cause slow prediction times, high latency, and inability to meet real-time inference requirements for production applications.","Optimize model architectures, use model quantization and pruning, implement model serving infrastructure with auto-scaling, and conduct performance testing."
"BR-033","AI/ML","Machine learning model bias and fairness","Algorithmic Bias and Discrimination","Compliance","Biased training data, inadequate fairness testing, and lack of bias mitigation can result in discriminatory model predictions that violate regulations, harm users, and damage organizational reputation.","Conduct bias audits, use diverse and representative training data, implement fairness metrics, and establish model governance processes with bias monitoring."
"BR-034","AI/ML","Machine learning model versioning and reproducibility","Model Reproducibility and Version Control Issues","Maintainability","Lack of proper model versioning, experiment tracking, and reproducibility practices can make it impossible to recreate models, debug issues, or roll back to previous versions.","Use MLOps platforms for experiment tracking, implement model versioning, maintain reproducible training pipelines, and document all model artifacts and dependencies."
"BR-035","AI/ML","Machine learning model monitoring and drift detection","Model Performance Degradation and Drift","Reliability","Models can degrade over time due to data drift, concept drift, or changing business conditions, leading to inaccurate predictions and reduced business value without proper monitoring.","Implement continuous model monitoring, track prediction accuracy and drift metrics, set up alerting for performance degradation, and establish model retraining schedules."
"BR-036","AI/ML","Machine learning feature engineering and selection","Feature Engineering Quality Issues","Data Integrity","Poor feature engineering, data leakage, and inadequate feature validation can result in models that perform well in training but fail in production or make predictions based on spurious correlations.","Implement rigorous feature validation, prevent data leakage, use cross-validation, conduct feature importance analysis, and maintain feature documentation."
"BR-037","AI/ML","Machine learning model explainability and interpretability","Lack of Model Explainability","Compliance","Black-box models without explainability can hinder regulatory compliance, reduce user trust, and make it difficult to debug model errors or understand decision-making processes.","Use interpretable models where appropriate, implement explainability techniques (SHAP, LIME), document model logic, and provide prediction explanations to stakeholders."
"BR-038","AI/ML","Machine learning model security and adversarial attacks","Adversarial Attack Vulnerabilities","Security","ML models are vulnerable to adversarial attacks where carefully crafted inputs can cause misclassification, model evasion, or extraction of sensitive training data.","Implement adversarial training, use input validation and sanitization, conduct security testing with adversarial examples, and monitor for anomalous inputs."
"BR-039","AI/ML","Machine learning infrastructure and compute resources","GPU/TPU Resource Contention and Costs","Performance","High computational requirements for model training and inference can lead to resource contention, excessive costs, and inability to scale ML workloads efficiently.","Implement resource scheduling and quotas, use spot instances for training, optimize model architectures for efficiency, and monitor compute costs with alerting."
"BR-040","AI/ML","Machine learning data privacy and confidentiality","Training Data Privacy Violations","Compliance","Using sensitive personal data for model training without proper consent, anonymization, or privacy-preserving techniques can violate privacy regulations and expose organizations to legal risks.","Implement differential privacy, use federated learning where appropriate, anonymize training data, obtain proper consent, and conduct privacy impact assessments."
"BR-041","AI/ML","Machine learning model deployment automation","Model Deployment Pipeline Failures","DevOps/Deployment","Inadequate CI/CD for ML models, lack of automated testing, and poor deployment practices can result in failed deployments, production incidents, and model downtime.","Implement MLOps pipelines with automated testing, use canary deployments, implement rollback mechanisms, and conduct integration testing before production deployment."
"BR-042","AI/ML","Machine learning model scalability","Model Serving Scalability Limitations","Scalability","Models may struggle to scale to handle high inference request volumes, leading to increased latency, timeouts, and inability to meet business demands during peak usage.","Use scalable model serving platforms, implement horizontal scaling, use model optimization techniques, implement caching strategies, and conduct load testing."
"BR-043","AI/ML","Machine learning experiment management","Experiment Tracking and Collaboration Challenges","Maintainability","Lack of centralized experiment tracking, poor collaboration tools, and inadequate documentation can hinder team productivity, make it difficult to reproduce results, and slow model development.","Use MLOps platforms for experiment tracking, implement collaborative workflows, maintain experiment documentation, and establish best practices for model development."
"BR-044","AI/ML","Machine learning model governance and compliance","Inadequate Model Governance","Compliance","Lack of model governance frameworks, approval processes, and compliance controls can result in unvetted models reaching production, regulatory violations, and ethical concerns.","Establish model governance committees, implement approval workflows, conduct model risk assessments, maintain model inventories, and ensure regulatory compliance."
"BR-045","AI/ML","Machine learning feature store management","Feature Store Consistency Issues","Data Integrity","Inconsistencies between training and serving features, stale features, and lack of feature versioning can cause training-serving skew and degraded model performance in production.","Implement centralized feature stores, ensure feature consistency across environments, version features, and monitor feature freshness and quality."
"BR-046","AI/ML","Machine learning model intellectual property","Model Theft and IP Protection","Security","Valuable ML models can be stolen through model extraction attacks, unauthorized access, or insider threats, resulting in loss of competitive advantage and intellectual property.","Implement access controls for model artifacts, use model watermarking, monitor for extraction attempts, encrypt model files, and establish IP protection policies."
"BR-047","AI/ML","Machine learning hyperparameter tuning","Inefficient Hyperparameter Optimization","Performance","Manual hyperparameter tuning, lack of automated optimization, and inefficient search strategies can result in suboptimal models, wasted compute resources, and prolonged development cycles.","Use automated hyperparameter optimization tools, implement efficient search strategies (Bayesian optimization), set resource budgets, and track optimization experiments."
"BR-048","AI/ML","Machine learning model testing and validation","Inadequate Model Testing Coverage","Reliability","Insufficient testing of edge cases, adversarial inputs, and production scenarios can allow buggy or unreliable models to reach production, causing incorrect predictions and business impact.","Implement comprehensive testing strategies including unit tests, integration tests, A/B testing, shadow deployments, and adversarial testing before production release."
"BR-049","AI/ML","Machine learning data labeling and annotation","Training Data Labeling Quality Issues","Data Integrity","Poor quality labels, inconsistent annotation guidelines, and lack of labeling validation can result in models trained on incorrect data, leading to poor performance and unreliable predictions.","Implement quality control for labeling, use multiple annotators with consensus mechanisms, provide clear guidelines, conduct regular audits, and use active learning."
"BR-050","AI/ML","Machine learning model retraining and updates","Model Update and Retraining Risks","Reliability","Frequent model updates without proper validation, lack of staged rollouts, and inadequate testing can introduce regressions, degrade performance, or cause production incidents.","Implement staged rollout strategies, conduct A/B testing for model updates, maintain rollback capabilities, and establish validation criteria before full deployment."
"BR-051","AI/ML","Machine learning model documentation","Insufficient Model Documentation","Maintainability","Lack of comprehensive model documentation, including architecture, training data, limitations, and intended use cases, can hinder model maintenance, troubleshooting, and responsible deployment.","Implement model cards, document training procedures and data sources, maintain architecture diagrams, document known limitations, and establish documentation standards."
"BR-052","AI/ML","Machine learning inference latency requirements","Real-Time Inference Latency Violations","Performance","Models that cannot meet strict latency requirements for real-time applications can cause poor user experience, timeouts, and inability to support time-sensitive business processes.","Optimize model architectures for inference speed, use model compression techniques, implement efficient serving infrastructure, and conduct latency testing under load."
"BR-053","AI/ML","Machine learning model availability and uptime","Model Serving Infrastructure Downtime","Availability","Single points of failure, inadequate redundancy, and lack of high availability architecture can cause model serving downtime, impacting business operations that depend on ML predictions.","Implement redundant model serving infrastructure, use load balancing, deploy across multiple availability zones, implement health checks, and establish SLA monitoring."
"BR-054","AI/ML","Machine learning model feedback loops","Negative Feedback Loop Amplification","Reliability","Models that influence their own training data through feedback loops can amplify biases, create self-fulfilling prophecies, or degrade over time without proper monitoring and intervention.","Monitor for feedback loops, implement safeguards against bias amplification, use diverse data sources, conduct regular model audits, and establish intervention protocols."
