Risk ID,Risk Description,Potential Impact,Tech Stack,Category of Risks
INT-SEC-001,"Broken Object Level Authorization (BOLA) in APIs, allowing unauthorized access to data by manipulating resource IDs in requests.","Sensitive data exposure, privacy violations, unauthorized data modification or deletion.",Architecture - Integration,Security & Vulnerability Risks
INT-SEC-002,"Failure to implement proper authentication across all integration endpoints, leaving some services publicly exposed.","Unauthorized system access, data breaches, service manipulation.",Architecture - Integration,Security & Vulnerability Risks
INT-SEC-003,"Hardcoded credentials, API keys, or tokens within application code, configuration files, or public repositories.","Full system compromise, unauthorized access on behalf of the compromised identity.",Architecture - Integration,Security & Vulnerability Risks
INT-SEC-004,"Excessive data exposure where APIs return full internal data objects, relying on the client to filter sensitive information.","Unintentional leakage of Personally Identifiable Information (PII) or other sensitive data.",Architecture - Integration,Security & Vulnerability Risks
INT-SEC-005,"Lack of rate limiting and throttling on APIs, making them vulnerable to Denial of Service (DoS) or brute-force attacks.","Service unavailability, resource exhaustion, increased operational costs.",Architecture - Integration,Security & Vulnerability Risks
INT-SEC-006,"Broken Function Level Authorization, allowing users to access administrative or privileged functions they are not authorized for.","Privilege escalation, unauthorized system configuration changes, full system takeover.",Architecture - Integration,Security & Vulnerability Risks
INT-SEC-007,"Improper asset management, leading to 'shadow' or 'zombie' APIs (unmanaged or deprecated versions) that remain active and unpatched.","Increased attack surface, exploitation of unpatched vulnerabilities.",Architecture - Integration,Security & Vulnerability Risks
INT-SEC-008,"Security misconfiguration, such as insecure default settings, verbose error messages revealing internal architecture, or unnecessary open ports.","System information leakage, providing attackers with a roadmap for further exploitation.",Architecture - Integration,Security & Vulnerability Risks
INT-SEC-009,"Injection flaws (e.g., SQL, NoSQL, OS command injection) where untrusted data is sent to an interpreter as part of a command or query.","Data exfiltration, data corruption, remote code execution.",Architecture - Integration,Security & Vulnerability Risks
INT-SEC-010,"Insecure deserialization of data from integrated systems, allowing remote code execution or denial-of-service attacks.","Remote code execution, application crashes, data tampering.",Architecture - Integration,Security & Vulnerability Risks
INT-SEC-011,"Insufficient logging and monitoring of integration points, preventing timely detection of and response to security incidents.","Delayed breach detection, inability to perform forensic analysis, attackers maintaining persistent access.",Architecture - Integration,Security & Vulnerability Risks
INT-SEC-012,"Server-Side Request Forgery (SSRF) where an attacker can coerce the application to make requests to an unintended internal or external location.","Bypassing firewalls, internal network scanning, access to internal services and sensitive data.",Architecture - Integration,Security & Vulnerability Risks
INT-SEC-013,"Mass assignment vulnerability, allowing attackers to modify internal object properties by passing unexpected fields in API requests (e.g., setting 'isAdmin' to true).","Privilege escalation, unauthorized data modification, bypassing security controls.",Architecture - Integration,Security & Vulnerability Risks
INT-SEC-014,"Use of integration components with known, unpatched vulnerabilities (e.g., outdated libraries, message brokers, or API gateways).","System compromise through exploitation of known CVEs.",Architecture - Integration,Security & Vulnerability Risks
INT-SEC-015,"Weak or missing transport layer encryption (TLS/SSL) for data in transit between services.","Man-in-the-middle attacks, data sniffing, session hijacking.",Architecture - Integration,Security & Vulnerability Risks
INT-SEC-016,"Unprotected metadata endpoints (e.g., OpenAPI/Swagger specs) that reveal sensitive information about API structure and logic.","Information leakage, aiding attackers in mapping the application's attack surface.",Architecture - Integration,Security & Vulnerability Risks
INT-SEC-017,"Improperly secured message queues or event streams, allowing unauthorized publishing or consumption of messages.","Data injection, information disclosure, denial of service, business logic manipulation.",Architecture - Integration,Security & Vulnerability Risks
INT-SEC-018,"Cross-Origin Resource Sharing (CORS) misconfiguration, allowing malicious websites to make requests to the API from a user's browser.","Data theft, unauthorized actions on behalf of the user.",Architecture - Integration,Security & Vulnerability Risks
INT-SEC-019,"Use of excessively long-lived JWTs or other access tokens, increasing the window of opportunity for misuse if stolen.","Prolonged unauthorized access, account takeover.",Architecture - Integration,Security & Vulnerability Risks
INT-SEC-020,"Lack of input validation on data received from integrated systems, trusting that all connected systems send clean data.","Data corruption, processing failures, downstream injection vulnerabilities.",Architecture - Integration,Security & Vulnerability Risks
INT-SEC-021,"Insecure file uploads through APIs without proper validation of file type, size, or content.","Remote code execution via malicious scripts, denial of service through resource exhaustion.",Architecture - Integration,Security & Vulnerability Risks
INT-SEC-022,"Failure to validate webhook authenticity, allowing attackers to send malicious payloads to callback endpoints.","System manipulation, data injection, triggering of unauthorized workflows.",Architecture - Integration,Security & Vulnerability Risks
INT-SEC-023,"Inadequate tenant isolation in a multi-tenant integration platform, allowing one tenant to access another's data or resources.","Major data breach, privacy violations, loss of customer trust.",Architecture - Integration,Security & Vulnerability Risks
INT-SEC-024,"Business logic flaws in the integration workflow that can be manipulated for financial gain or to bypass controls (e.g., reusing a discount code).","Financial loss, fraud, reputational damage.",Architecture - Integration,Security & Vulnerability Risks
INT-SEC-025,"XML External Entity (XXE) injection in services that parse XML, allowing attackers to access local files or internal network resources.","Data exfiltration, server-side request forgery (SSRF), denial of service.",Architecture - Integration,Security & Vulnerability Risks
AIP-001,"Synchronous communication patterns for long-running integration tasks lead to thread exhaustion and service timeouts under moderate load.","Service unavailability, cascading failures across dependent systems, poor user experience due to high latency.",Architecture - Integration,Performance & Scalability Risks
AIP-002,"Lack of a scalable event-driven architecture for real-time data synchronization results in data processing backlogs and stale information.","Inconsistent data across enterprise systems, flawed business intelligence and reporting, operational inefficiencies.",Architecture - Integration,Performance & Scalability Risks
AIP-003,"Inefficient data transformation logic within integration middleware (ETL/ELT) causes significant processing delays and high CPU utilization.","Batch window overruns, increased infrastructure costs, delayed availability of critical business data.",Architecture - Integration,Performance & Scalability Risks
AIP-004,"Absence of a circuit breaker pattern in inter-service communication allows failures in a downstream service to cascade, causing widespread outages.","System-wide instability, prolonged recovery times, significant disruption to business operations.",Architecture - Integration,Performance & Scalability Risks
AIP-005,"Using verbose data formats like XML for high-volume, low-latency integrations instead of efficient formats like Protobuf or Avro.","Increased network bandwidth consumption and costs, higher serialization/deserialization overhead, slower response times.",Architecture - Integration,Performance & Scalability Risks
AIP-006,"Poorly configured or non-existent connection pooling for databases and other backend resources leads to resource exhaustion.","Application crashes, inability to handle concurrent user requests, database performance degradation.",Architecture - Integration,Performance & Scalability Risks
AIP-007,"Integration points lack pagination, attempting to fetch and process excessively large datasets in a single request.","Out-of-memory errors on server and client, network timeouts, extreme latency for end-users.",Architecture - Integration,Performance & Scalability Risks
AIP-008,"Centralized integration hub (e.g., monolithic ESB) becomes a single point of failure and a performance bottleneck for the entire enterprise.","Complete halt of inter-system communication if the hub fails, inability to scale individual integration flows independently.",Architecture - Integration,Performance & Scalability Risks
AIP-009,"Auto-scaling policies for integration components are too slow to react to sudden traffic spikes, leading to request throttling and errors.","Service degradation or unavailability during peak business hours, loss of transactions, negative customer impact.",Architecture - Integration,Performance & Scalability Risks
AIP-010,"Lack of distributed caching for frequently accessed, static data results in redundant calls to backend systems.","Unnecessary load on databases and legacy systems, increased latency for API responses, higher operational costs.",Architecture - Integration,Performance & Scalability Risks
AIP-011,"Chatty integration patterns where a single business process requires a long chain of synchronous calls between multiple services.","Exponentially increased response time, high coupling between services, difficulty in troubleshooting performance issues.",Architecture - Integration,Performance & Scalability Risks
AIP-012,"Inefficient message queuing strategy, such as using a single queue for all message types, creates head-of-line blocking.","High-priority messages are delayed by low-priority ones, processing bottlenecks, uneven system throughput.",Architecture - Integration,Performance & Scalability Risks
AIP-013,"Failure to implement idempotent message processing in asynchronous integrations leads to data duplication upon retries.","Data corruption, incorrect financial calculations, compliance violations due to duplicated records.",Architecture - Integration,Performance & Scalability Risks
AIP-014,"Geographic latency due to deploying integrated services in data centers far from their consumers or each other.","Noticeably slow performance for international users, increased data transfer costs, challenges with data residency compliance.",Architecture - Integration,Performance & Scalability Risks
AIP-015,"Lack of load balancing or use of a basic round-robin strategy for stateful services, leading to session data loss and errors.","Failed user sessions, inconsistent application behavior, poor distribution of load across available resources.",Architecture - Integration,Performance & Scalability Risks
AIP-016,"The N+1 query problem within an integration service, where one incoming request triggers numerous unnecessary backend calls.","Severe performance degradation, database server overload, slow API response times.",Architecture - Integration,Performance & Scalability Risks
AIP-017,"Inadequate monitoring and tracing across distributed integration points makes it impossible to identify performance bottlenecks.","Increased Mean Time to Resolution (MTTR) for performance incidents, inability to proactively optimize the system.",Architecture - Integration,Performance & Scalability Risks
AIP-018,"Using heavyweight protocols (e.g., SOAP) for internal, high-performance microservice communication where lightweight options (gRPC) are more suitable.","Increased CPU and memory usage, higher network overhead, reduced overall system throughput.",Architecture - Integration,Performance & Scalability Risks
AIP-019,"Data skew in distributed data processing jobs (e.g., Spark) where one partition contains a disproportionate amount of data.","Straggler tasks that slow down the entire job, inefficient resource utilization, potential for job failures.",Architecture - Integration,Performance & Scalability Risks
AIP-020,"Hardcoded timeouts and retry logic in integration clients that are not adaptable to network conditions or service health.","Premature request failures, retry storms that exacerbate an outage, inability to gracefully handle transient faults.",Architecture - Integration,Performance & Scalability Risks
AIP-021,"Lack of a Content Delivery Network (CDN) for caching API responses that are static or change infrequently.","Higher latency for global users, increased load on origin servers, higher data egress costs.",Architecture - Integration,Performance & Scalability Risks
AIP-022,"Stateful services in an integration architecture that are difficult to scale horizontally, creating a scaling bottleneck.","Inability to handle increased load by adding more instances, complex and costly vertical scaling, single point of failure.",Architecture - Integration,Performance & Scalability Risks
AIP-023,"Inefficient database indexing strategy for tables frequently queried by integration services, resulting in full table scans.","Extremely slow query performance, high database CPU load, application timeouts.",Architecture - Integration,Performance & Scalability Risks
AIP-024,"Overhead from service discovery mechanisms in a large-scale microservices environment adds significant latency to the first request.","Slow application startup times, increased latency for service-to-service communication, complex dependency management.",Architecture - Integration,Performance & Scalability Risks
AIP-025,"Failure to compress HTTP payloads in API integrations, leading to slow transfer times over latent or low-bandwidth networks.","Poor performance for mobile or remote users, increased bandwidth costs, slower rendering of data in client applications.",Architecture - Integration,Performance & Scalability Risks
AIP-026,"Complex distributed transaction logic (e.g., two-phase commit) across multiple systems creates blocking and reduces throughput.","System-wide deadlocks, reduced concurrency, significant performance penalty compared to eventual consistency models.",Architecture - Integration,Performance & Scalability Risks
INT-PS-001,"Synchronous integration chains where a single slow downstream service increases latency for the entire transaction.","High end-user response times, increased resource holding, higher probability of timeouts.",Architecture - Integration,Performance & Scalability Risks
INT-PS-002,"Lack of a dedicated API Gateway, leading to inconsistent application of cross-cutting concerns like rate limiting, authentication, and logging.","Difficulty in managing and securing APIs, inconsistent performance, potential for system abuse.",Architecture - Integration,Performance & Scalability Risks
INT-PS-003,"Inefficient data serialization/deserialization format (e.g., verbose XML) used for high-throughput integrations.","Increased network bandwidth consumption, higher CPU usage for parsing, and added latency.",Architecture - Integration,Performance & Scalability Risks
INT-PS-004,"Absence of end-to-end distributed tracing, making it difficult to identify performance bottlenecks in a multi-service workflow.","Increased Mean Time to Resolution (MTTR) for performance incidents, inability to optimize complex call chains.",Architecture - Integration,Performance & Scalability Risks
INT-PS-005,"Stateful integration components that prevent horizontal scaling, creating a bottleneck as transaction volume grows.","Inability to meet scalability requirements, service degradation under peak load, single point of failure.",Architecture - Integration,Performance & Scalability Risks
INT-PS-006,"Over-reliance on a centralized Enterprise Service Bus (ESB) creating a monolithic integration bottleneck and a single point of failure.","System-wide outages from a single component failure, difficulty in scaling and deploying individual integrations.",Architecture - Integration,Performance & Scalability Risks
INT-PS-007,"Integration with third-party services that have no defined Service Level Agreements (SLAs) for performance or availability.","Unpredictable application performance, cascading failures due to unreliable external dependencies.",Architecture - Integration,Performance & Scalability Risks
INT-PS-008,"Failure to implement retry logic with exponential backoff for transient failures in remote service calls.","System overload from rapid retries (retry storms), cascading failures, poor resilience.",Architecture - Integration,Performance & Scalability Risks
INT-PS-009,"Inadequate database connection pooling for integration services, leading to pool exhaustion under high load.","Service unavailability, high latency as requests wait for a connection, potential for database server overload.",Architecture - Integration,Performance & Scalability Risks
INT-PS-010,"Using point-to-point integrations for a many-to-many service communication model, leading to a complex and brittle 'spaghetti' architecture.","High maintenance overhead, difficulty in scaling, performance issues due to tangled dependencies.",Architecture - Integration,Performance & Scalability Risks
INT-PS-011,"Large, non-streaming data payloads for batch integrations, causing high memory consumption and potential for out-of-memory errors.","Service crashes, slow processing times, inability to handle large data volumes.",Architecture - Integration,Performance & Scalability Risks
INT-PS-012,"Misconfigured or missing caching layers for frequently requested, non-volatile data from integrated systems.","Unnecessary load on downstream systems, increased response latency, higher operational costs.",Architecture - Integration,Performance & Scalability Risks
INT-PS-013,"Complex data transformation logic embedded within the integration layer, consuming excessive CPU and increasing latency.","Performance bottlenecks, difficulty in scaling the integration layer, tight coupling of services.",Architecture - Integration,Performance & Scalability Risks
INT-PS-014,"Lack of a message queue for decoupling long-running asynchronous processes from synchronous API calls.","Long API response times, poor user experience, risk of client-side timeouts.",Architecture - Integration,Performance & Scalability Risks
INT-PS-015,"Inconsistent data models and formats between integrated services, requiring constant, performance-intensive transformations.","Increased development complexity, higher processing overhead, potential for data integrity issues.",Architecture - Integration,Performance & Scalability Risks
INT-PS-016,"Failure to scale dependent services in tandem, where a scalable front-end service is bottlenecked by a non-scalable backend integration.","Overall system performance is limited by the weakest link, wasted resources on the scalable component.",Architecture - Integration,Performance & Scalability Risks
INT-PS-017,"Absence of circuit breaker patterns for integrations, allowing failures in one service to cascade and cause widespread outages.","Reduced system availability, catastrophic failure propagation across the architecture.",Architecture - Integration,Performance & Scalability Risks
INT-PS-018,"High network latency between geographically distributed services that are part of a synchronous request chain.","Significantly increased end-to-end transaction time, poor performance for users far from the service region.",Architecture - Integration,Performance & Scalability Risks
INT-PS-019,"Using a 'chatty' integration pattern that requires multiple round-trips to fulfill a single business function.","High cumulative latency, increased network overhead, brittle coupling between client and server.",Architecture - Integration,Performance & Scalability Risks
INT-PS-020,"Lack of load testing for critical integration points, leading to unexpected performance degradation or failure in production.","Service outages during peak traffic events, reputational damage, emergency resource scaling.",Architecture - Integration,Performance & Scalability Risks
INT-PS-021,"Improperly configured auto-scaling policies for integration microservices that react too slowly to traffic spikes.","Service degradation or unavailability during sudden load increases, poor user experience.",Architecture - Integration,Performance & Scalability Risks
INT-PS-022,"Failure to implement bulkhead patterns to isolate resources, allowing one faulty integration to consume all resources and impact others.","Cascading failures, where a single misbehaving service brings down multiple unrelated services.",Architecture - Integration,Performance & Scalability Risks
INT-PS-023,"Using blocking I/O models in high-concurrency integration services instead of non-blocking, event-driven models.","Thread exhaustion, poor scalability, high resource consumption under concurrent load.",Architecture - Integration,Performance & Scalability Risks
INT-PS-024,"Neglecting to version integration APIs, leading to breaking changes that disrupt service consumers and are hard to scale or update.","Forced, coordinated deployments across multiple teams; service disruptions for clients on older versions.",Architecture - Integration,Performance & Scalability Risks
INT-PS-025,"Inefficient service discovery mechanism in a microservices environment, adding significant latency to the first call of any interaction.","Increased response times for inter-service communication, potential for discovery service to become a bottleneck.",Architecture - Integration,Performance & Scalability Risks
DX-AI-001,"Inconsistent API design patterns across different microservices (e.g., varying naming conventions, status codes, and error formats).","Increased cognitive load for developers, slower integration times, higher likelihood of implementation errors, and increased maintenance overhead.",Architecture - Integration,Design & Developer Experience Risks
DX-AI-002,"API documentation is missing, outdated, or inaccurate, failing to reflect the current state of the services.","Wasted developer time on trial-and-error discovery, incorrect API usage, project delays, and increased reliance on institutional knowledge.",Architecture - Integration,Design & Developer Experience Risks
DX-AI-003,"Overly complex or inconsistent authentication and authorization mechanisms required to access different internal APIs.","Significant developer friction, delays in starting new projects, and potential for security misconfigurations as developers seek workarounds.",Architecture - Integration,Design & Developer Experience Risks
DX-AI-004,"Lack of well-maintained SDKs or client libraries, forcing each consuming team to write boilerplate HTTP client and data-binding code.","Duplication of effort across teams, inconsistent implementation of API clients, slower feature delivery, and a higher chance of bugs.",Architecture - Integration,Design & Developer Experience Risks
DX-AI-005,"The local development environment setup is complex and time-consuming, requiring manual configuration of multiple services and databases.","Slow developer onboarding, reduced productivity, discourages experimentation, and increases the 'it works on my machine' problem.",Architecture - Integration,Design & Developer Experience Risks
DX-AI-006,"Tight coupling between services where a change in one service requires coordinated changes and deployments in multiple other services.","Reduced development velocity, increased risk of cascading failures, difficulty in scaling development teams, and discourages refactoring.",Architecture - Integration,Design & Developer Experience Risks
DX-AI-007,"Inconsistent data models for the same business entity (e.g., 'Customer') across different service domains and databases.","Increased complexity in data transformation logic, data integrity issues, synchronization bugs, and confusion for developers.",Architecture - Integration,Design & Developer Experience Risks
DX-AI-008,"Absence of a centralized schema registry or contract repository for event-driven and microservice architectures.","Runtime integration failures due to contract mismatches, data corruption, significant time spent debugging interoperability issues.",Architecture - Integration,Design & Developer Experience Risks
DX-AI-009,"CI/CD pipelines are slow and complex, resulting in long feedback loops for developers waiting to see the results of their changes.","Reduced developer productivity and satisfaction, slower time-to-market for new features, and discourages frequent, small commits.",Architecture - Integration,Design & Developer Experience Risks
DX-AI-010,"Poorly communicated or overly restrictive API rate limiting, causing unexpected '429 Too Many Requests' errors during development and testing.","Developer frustration, unreliable testing environments, and difficulty in building resilient client applications.",Architecture - Integration,Design & Developer Experience Risks
