Risk ID,Risk Description,Potential Impact,Tech Stack,Category of Risks
DX-AI-011,"Lack of a shared library or framework for common concerns like logging, tracing, and metrics, leading to inconsistent observability.","Difficulty in debugging and monitoring applications in production, increased mean time to resolution (MTTR) for incidents.",Architecture - Integration,Design & Developer Experience Risks
DX-AI-012,"The integration architecture relies on legacy or deprecated technologies that have poor community support and a small talent pool.","Difficulty in hiring and retaining developers, security risks from unmaintained components, and challenges in modernizing the stack.",Architecture - Integration,Design & Developer Experience Risks
DX-AI-013,"Error messages returned by APIs are generic and non-descriptive (e.g., 'An error occurred'), providing no actionable information.","Increased debugging time, developer frustration, and difficulty for client applications to handle errors gracefully.",Architecture - Integration,Design & Developer Experience Risks
DX-AI-014,"The architecture does not support easy end-to-end testing, requiring complex test harnesses and extensive mocking.","Brittle tests, low confidence in releases, slower development cycles, and an increase in production bugs.",Architecture - Integration,Design & Developer Experience Risks
DX-AI-015,"No clear ownership or support model for shared integration components or platforms.","Delays in getting support, components becoming outdated or unmaintained, and developers creating shadow IT solutions.",Architecture - Integration,Design & Developer Experience Risks
DX-AI-016,"The architecture mandates a specific programming language or framework that is ill-suited for certain tasks, stifling polyglot approaches.","Sub-optimal solutions, reduced developer morale, and inability to leverage the best tool for the job.",Architecture - Integration,Design & Developer Experience Risks
DX-AI-017,"Lack of tooling for generating API clients and documentation from a contract definition (e.g., OpenAPI/Swagger, gRPC).","Manual, error-prone work to keep clients and documentation in sync with the API, leading to inconsistencies.",Architecture - Integration,Design & Developer Experience Risks
DX-AI-018,"The process for proposing and implementing changes to shared data contracts or API designs is bureaucratic and slow.","Innovation is stifled, development teams become blocked, and agility is lost.",Architecture - Integration,Design & Developer Experience Risks
DX-AI-019,"Integration points lack versioning, making it impossible to roll out breaking changes without coordinating a 'big bang' release.","High-risk deployments, inability to evolve APIs gracefully, and prolonged dependency on legacy clients.",Architecture - Integration,Design & Developer Experience Risks
DX-AI-020,"The data integration strategy requires developers to write complex, low-level ETL or data synchronization jobs.","High development cost, brittle data pipelines, and specialized knowledge required to maintain the system.",Architecture - Integration,Design & Developer Experience Risks
DX-AI-021,"No self-service capability for developers to provision test environments or access sandboxed versions of dependent services.","Developers are blocked waiting for operations teams, leading to significant delays and reduced productivity.",Architecture - Integration,Design & Developer Experience Risks
DX-AI-022,"The architecture produces 'chatty' integrations, requiring multiple round-trips between services to complete a single business transaction.","Poor performance, increased network overhead, and complex state management for client applications.",Architecture - Integration,Design & Developer Experience Risks
DX-AI-023,"Onboarding guides for new developers are non-existent or assume a high level of pre-existing knowledge about the system architecture.","Extremely long ramp-up time for new hires, high pressure on senior developers for mentoring, and inconsistent initial setup.",Architecture - Integration,Design & Developer Experience Risks
DX-AI-024,"The chosen integration patterns (e.g., synchronous REST calls for everything) do not align with the business requirements, leading to poor resilience.","System fragility, where the failure of one non-critical service can cause a system-wide outage.",Architecture - Integration,Design & Developer Experience Risks
DX-AI-025,"Lack of a clear feedback mechanism for developers to report issues or suggest improvements for shared platforms and APIs.","Developer concerns go unheard, platforms fail to evolve based on user needs, and a culture of frustration develops.",Architecture - Integration,Design & Developer Experience Risks
GO-001,"Lack of a formally adopted and enforced enterprise architecture framework, leading to inconsistent and ad-hoc integration patterns.","Increased development costs, technical debt, system brittleness, and difficulty in maintaining or scaling solutions.",Architecture - Integration,Governance & Operational Risks
GO-002,"Failure to establish a central integration governance board or center for enablement (C4E) to oversee standards and best practices.","Proliferation of redundant integration solutions, inconsistent quality, and lack of strategic alignment with business goals.",Architecture - Integration,Governance & Operational Risks
GO-003,"Over-reliance on point-to-point integrations instead of a standardized middleware or API gateway approach.","Creation of a 'spaghetti architecture' that is costly to change, difficult to monitor, and prone to cascading failures.",Architecture - Integration,Governance & Operational Risks
GO-004,"Inadequate data governance policies for data in transit, leading to inconsistent data quality and semantics between systems.","Poor decision-making based on unreliable data, compliance violations (e.g., GDPR, CCPA), and loss of business trust.",Architecture - Integration,Governance & Operational Risks
GO-005,"Absence of a unified data catalog and lineage tracking across integrated systems.","Inability to perform impact analysis for changes, difficulty in troubleshooting data issues, and failure to meet audit and regulatory requirements.",Architecture - Integration,Governance & Operational Risks
GO-006,"Vendor lock-in due to deep integration with proprietary protocols or platform-specific services (e.g., custom AWS Step Functions logic, vendor-specific API formats).","Reduced negotiating power with vendors, high switching costs, and inability to adapt to new technologies or multi-cloud strategies.",Architecture - Integration,Governance & Operational Risks
GO-007,"Inconsistent security models and identity propagation mechanisms across integrated applications and services.","Security vulnerabilities, unauthorized data access, and complex, error-prone security administration.",Architecture - Integration,Governance & Operational Risks
GO-008,"Lack of a centralized monitoring and observability strategy for integration flows and APIs.","Prolonged service disruptions, inability to proactively identify performance bottlenecks, and violation of Service Level Agreements (SLAs).",Architecture - Integration,Governance & Operational Risks
GO-009,"Failure to define and manage the full lifecycle (design, publish, deprecate, retire) of APIs and integration services.","API sprawl, consumption of outdated or insecure endpoints, and operational overhead from maintaining unused assets.",Architecture - Integration,Governance & Operational Risks
GO-010,"Poorly defined ownership and accountability for cross-functional integration points.","Delayed incident resolution, blame-shifting between teams, and lack of proactive maintenance or improvement.",Architecture - Integration,Governance & Operational Risks
GO-011,"Insufficient operational runbooks and automated recovery procedures for critical integration failures.","Extended Mean Time to Recovery (MTTR), significant business disruption, and reputational damage.",Architecture - Integration,Governance & Operational Risks
GO-012,"Architectural design that does not account for scalability and elasticity at integration choke points (e.g., message queues, API gateways).","System-wide performance degradation or failure during peak loads, leading to lost revenue and poor customer experience.",Architecture - Integration,Governance & Operational Risks
GO-013,"Absence of a formal versioning strategy for APIs and integration contracts.","Breaking changes that disrupt dependent applications, requiring costly coordinated updates and causing service outages.",Architecture - Integration,Governance & Operational Risks
GO-014,"Inadequate management of secrets, keys, and certificates used for securing integration channels.","High risk of security breaches, man-in-the-middle attacks, and data interception if credentials are compromised or expire unexpectedly.",Architecture - Integration,Governance & Operational Risks
GO-015,"Lack of standardized error handling and retry logic across microservices and integration components.","Inconsistent system behavior, cascading failures from transient errors, and difficulty in diagnosing root causes.",Architecture - Integration,Governance & Operational Risks
GO-016,"Failure to implement a 'single source of truth' for master data, resulting in data duplication and inconsistency across systems.","Operational inefficiencies, conflicting business reports, and a poor, fragmented customer experience.",Architecture - Integration,Governance & Operational Risks
GO-017,"Integration architecture that does not support asynchronous communication patterns where appropriate.","Reduced system resilience and tight coupling; a failure in one service can immediately impact the availability of another.",Architecture - Integration,Governance & Operational Risks
GO-018,"Neglecting to establish a chargeback or showback model for shared integration platforms.","Uncontrolled consumption of shared resources, budget overruns, and lack of accountability for platform costs.",Architecture - Integration,Governance & Operational Risks
GO-019,"Absence of a formal process for reviewing and approving new integration technologies and patterns.","Technology sprawl, introduction of unsupported or insecure tools, and dilution of architectural standards.",Architecture - Integration,Governance & Operational Risks
GO-020,"Failure to incorporate disaster recovery (DR) and business continuity planning into the integration architecture.","Inability to recover critical business functions in the event of a major outage, leading to significant financial and reputational loss.",Architecture - Integration,Governance & Operational Risks
GO-021,"Insufficient logging and auditing capabilities within integration flows, making it impossible to trace transactions end-to-end.","Inability to meet compliance requirements, resolve disputes, or investigate security incidents effectively.",Architecture - Integration,Governance & Operational Risks
GO-022,"Creation of 'shadow IT' integrations by business units without central oversight.","Data silos, security vulnerabilities, compliance risks, and redundant spending on unapproved integration tools.",Architecture - Integration,Governance & Operational Risks
GO-023,"Architectural patterns that create circular dependencies between services or systems.","Deployment deadlocks, cascading failures, and extreme difficulty in isolating and resolving system issues.",Architecture - Integration,Governance & Operational Risks
GO-024,"Lack of automated testing (unit, integration, contract) for integration components and APIs.","High rate of production defects, slow and manual release cycles, and low confidence in making changes to the system.",Architecture - Integration,Governance & Operational Risks
GO-025,"Failure to govern the physical or logical network topology, leading to high-latency communication paths between integrated services.","Poor application performance, increased data transfer costs (especially across cloud regions), and suboptimal user experience.",Architecture - Integration,Governance & Operational Risks
ADE-001,"Prompt injection attacks where user input manipulates the behavior of an integrated Large Language Model (LLM), causing it to ignore previous instructions.","Reputational damage, generation of inappropriate content, bypass of security filters.",Architecture - Integration,AI and Data Engineering Specific Risks
ADE-002,"Sensitive PII or confidential corporate data being included in prompts sent to third-party, public AI services, violating data residency and privacy policies.","Data leakage, major compliance violations (GDPR, HIPAA), loss of intellectual property.",Architecture - Integration,AI and Data Engineering Specific Risks
ADE-003,"Lack of data lineage tracking for data used in ML model training, making it impossible to audit for bias or prove regulatory compliance.","Inability to explain model decisions, regulatory fines, reputational damage from biased outcomes.",Architecture - Integration,AI and Data Engineering Specific Risks
ADE-004,"Over-privileged service accounts for data pipelines (e.g., in Databricks or Snowflake) having write/delete access to production data stores.","Accidental or malicious data corruption/deletion, data breach.",Architecture - Integration,AI and Data Engineering Specific Risks
ADE-005,"AI model hallucination, where the model generates factually incorrect or nonsensical information that is then integrated into a business process or user-facing application.","Poor business decisions, loss of customer trust, legal liability.",Architecture - Integration,AI and Data Engineering Specific Risks
ADE-006,"Insecure data sharing configurations in cloud data platforms (e.g., public Snowflake shares, unauthenticated S3 buckets) used for partner data exchange.","Data breach, unauthorized access to sensitive datasets.",Architecture - Integration,AI and Data Engineering Specific Risks
ADE-007,"Model inversion attacks where an attacker can reverse-engineer the training data by repeatedly querying a deployed ML model API.","Exposure of sensitive training data, including PII.",Architecture - Integration,AI and Data Engineering Specific Risks
ADE-008,"Lack of monitoring for model drift, where the model's performance degrades over time as production data patterns change, leading to inaccurate predictions.","Flawed business insights, operational inefficiency, revenue loss.",Architecture - Integration,AI and Data Engineering Specific Risks
ADE-009,"Data poisoning attacks where an attacker intentionally feeds malicious data into a data pipeline to compromise the integrity of a downstream ML model.","Compromised model accuracy, creation of backdoors in the model, targeted misclassifications.",Architecture - Integration,AI and Data Engineering Specific Risks
ADE-010,"Uncontrolled compute costs in data engineering platforms (e.g., Databricks, Snowflake) due to inefficient queries or auto-scaling misconfigurations.","Significant budget overruns, resource contention.",Architecture - Integration,AI and Data Engineering Specific Risks
ADE-011,"Failure to anonymize or pseudonymize data before it is used in a lower, less secure data science environment.","Internal data breach, non-compliance with data minimization principles.",Architecture - Integration,AI and Data Engineering Specific Risks
ADE-012,"Indirect prompt injection, where an LLM is compromised by malicious data retrieved from an external data source it was asked to query.","AI manipulation, data exfiltration through the LLM, execution of unauthorized actions.",Architecture - Integration,AI and Data Engineering Specific Risks
ADE-013,"Lack of a centralized feature store, leading to redundant data processing, inconsistent feature engineering, and slower model development cycles.","Operational inefficiency, inconsistent model performance, increased data storage costs.",Architecture - Integration,AI and Data Engineering Specific Risks
ADE-014,"Denial of Service (DoS) against ML model endpoints by sending a high volume of complex inference requests that are computationally expensive.","Service unavailability for AI-powered features, excessive compute costs.",Architecture - Integration,AI and Data Engineering Specific Risks
ADE-015,"Inadequate access controls within data catalogs, allowing unauthorized users to discover and access sensitive data assets.","Internal data leakage, compliance violations.",Architecture - Integration,AI and Data Engineering Specific Risks
ADE-016,"Data quality issues in source systems propagating through ETL/ELT pipelines, leading to 'garbage in, garbage out' for AI/ML models.","Inaccurate analytics, flawed business decisions, loss of trust in data.",Architecture - Integration,AI and Data Engineering Specific Risks
ADE-017,"Insecure serialization of ML models, where a malicious actor could craft a compromised model file that executes arbitrary code when loaded.","Remote code execution on the model serving infrastructure, system compromise.",Architecture - Integration,AI and Data Engineering Specific Risks
ADE-018,"Lack of explainability (XAI) frameworks for black-box models, making it impossible to justify critical decisions (e.g., loan rejection) to regulators or customers.","Regulatory fines, legal challenges, reputational damage.",Architecture - Integration,AI and Data Engineering Specific Risks
ADE-019,"Mismanagement of secrets (e.g., database credentials, API keys) within data pipeline orchestration tools like Airflow or Prefect.","Unauthorized access to data sources and sinks, data exfiltration.",Architecture - Integration,AI and Data Engineering Specific Risks
ADE-020,"Adversarial attacks where subtle, imperceptible perturbations are added to input data to cause the model to misclassify it.","Bypass of security systems (e.g., fraud detection), incorrect medical diagnoses, system manipulation.",Architecture - Integration,AI and Data Engineering Specific Risks
ADE-021,"Bottlenecks in data streaming integrations (e.g., Kafka, Kinesis) causing data lag and preventing real-time analytics and model inference.","Stale insights, delayed alerting, poor user experience.",Architecture - Integration,AI and Data Engineering Specific Risks
ADE-022,"Violation of third-party AI service usage policies, leading to service termination or legal action.","Disruption of AI-dependent services, unexpected costs, legal entanglements.",Architecture - Integration,AI and Data Engineering Specific Risks
ADE-023,"Failure to implement role-based access control (RBAC) within data platforms, granting data scientists excessive permissions beyond their project scope.","Unauthorized data access, accidental data modification, internal security threats.",Architecture - Integration,AI and Data Engineering Specific Risks
ADE-024,"Intellectual property theft of proprietary ML models by insiders or through a system compromise.","Loss of competitive advantage, financial loss.",Architecture - Integration,AI and Data Engineering Specific Risks
ADE-025,"Unfairness or bias embedded in ML models due to skewed training data, leading to discriminatory outcomes against protected groups.","Reputational damage, legal action, loss of customer trust, regulatory penalties.",Architecture - Integration,AI and Data Engineering Specific Risks